Level,Message
Medium,Name=Request (POST:https://colliers.sharepoint.com/_forms/default.aspx<scrubbed>)
Medium,The request is for a root site - get the redirect URL directly colliers.sharepoint.com - colliers.sharepoint.com
Monitorable,Unknown SPSkuType types for [639dec6b-bb19-468b-871c-c5c441c4b0cb][be9f9771-1c64-4618-9907-244325141096][61902246-d7cb-453e-85cd-53ee28eec138]
Medium,"Initial: FileOperationType = [_Unknown], OperationId = [Authentication_FormsDefaultAuthPage], ComponentId = [AuthenticationApi]"
Medium,Intializing RpsContextCookie.
Medium,Extracting sign-in previous correlation ID from the rps context cookie. Value: '83421ba1-c01e-4000-ff0a-2473d9a6bb07'.
Medium,Using the Source element for sign-in target path.
Medium,Creating claims operaton scope with sign-in target.
Medium,Skip the cookie authentication for this request.
High,There are no tasks to execute asynchronously.
Medium,Site=/
Medium,"DGCache [2024-04-02 20:23:10Z] : 8916, 17896, 0x0000000000000000, 0, CSPRequest::HrRunMondoSproc, VdbSubweb::setDomainGroupCache
"
Medium,Using the Source element for sign-in target path.
Medium,No groups on windows token.
Medium,"SyntexPAYGEnabled:'False', Is setting valid:'False', Features enabled:'None'."
Medium,Checking for MSA tenant.
Medium,Tested site for MSA context. Value: 'False'.
Medium,The site configuration environment is null.
Medium,MsaTenant: SPOAuthHelper NOT configuring for MsaTenant because MsaTenantUtils.IsMsaTenant() is false.
Medium,This default auth mode is set. Value: 'OpenIdConnect'.
Medium,Request has an OpenID Connect state element in the query string. Key: 'state'.
Medium,Page is not sign-out page load.
Medium,Page is not sign-out page load.
Medium,The OpenID Connect request elements were calculated. RequestElement: 'IdToken | NonceCookie | OpenIDConnectState'.
Medium,Request does not have element. Value: 'False'.
Medium,Request does not have element. Value: 'False'.
Medium,Request has element. Value: 'False'.
Medium,Request has element. Value: 'False'.
Medium,Request has element. Value: 'False'.
Medium,This OpenID Connect request is for sign-in and has all the needed request elements potentially.
Medium,"Request initialized. RequestAuthenticationMode: 'OpenIdConnect', RequestType: 'IdentityProviderSignInSuccessReturnRequest'."
Medium,EvoStsAuthenticationPipeline Start: My Scenario Start
Medium,Entering authentication pipeline...
Medium,Not an invitation acceptance request.
Medium,This is a return from an identity provider. The pre-sign in correlation id: '83421ba1-c01e-4000-ff0a-2473d9a6bb07'.
Medium,This is a sign-in request.
Medium,Trying to sign in with the token returning from authentication provider.
Medium,Using IRPSSignInCallback2 for TryToAuthenticateFromRequest.
Medium,Request has element. Value: 'False'.
Medium,Trying to sign-in by building an SPOAuthToken from the request.
Medium,Attempting to build an SPOAuthToken from request.
Medium,Getting OpenID Connect token string from HTTP POST body. Key: 'id_token'.
Medium,Found a value with the key. Adding key prefix to value. Key: 'id_token'.
High,The HTTP context info accessor does not have cached IP address.
Medium,The request is made with a token with key identifier 'q-23falevZhhD3hm9CQbkP5MQyU' and thumbprint 'ABEDB77DA95EBD98610F7866F4241B90FE4C4325'.
Medium,Successfully built an OpenID Connect JSON token object from the raw ticket.
Medium,Audience Guid matches current App Id Guid. Audience: '00000003-0000-0ff1-ce00-000000000000'.
Medium,Audience Guid matches current App Id Guid. Audience: '00000003-0000-0ff1-ce00-000000000000'.
Medium,Successfully validated OpenID Connect JSON token.
Medium,Getting OpenID Connect code string from form. Key: 'code'.
Medium,Found a value with the key. Key: 'code'.
Medium,"Id token: '{""typ"":""JWT"",""alg"":""RS256"",""x5t"":""q-23falevZhhD3hm9CQbkP5MQyU"",""kid"":""q-23falevZhhD3hm9CQbkP5MQyU""}.{""aud"":""00000003-0000-0ff1-ce00-000000000000"",""iss"":""https://sts.windows.net/049e3382-8cdc-477b-9317-951b04689668/"",""iat"":1712114288,""nbf"":1712114288,""exp"":1712118188,""acrs"":[""urn:user:registersecurityinfo""],""aio"":""AUQAu/8WAAAAVxuwgV8ADVI4cEXkf+mFxVunVz9bqRNOj0lFwNdvg3MDummx4WaCiCjOgmXoFQXuTWIYsHpUkcxCeKcweY7xTg=="",""altsecid"":""5::10032002CC6815D0"",""amr"":[""pwd""],""auth_time"":1706733039,""c_hash"":""OI3fq0hYUaBUHHMmaIe6PQ"",""e_exp"":262798,""email"":""*@twgroup.co.nz"",""idp"":""https://sts.windows.net/07e47c7e-9339-473b-8138-adb77559c551/"",""ipaddr"":""203.97.64.20"",""name"":""*"",""nonce"":""C394A2889538CCB075EB6A6105F3422F099774D7F10DAD64-394A1EF663185D5C2A0E3854B36814F665BB00AB80C53E596C0E3585D418D3EF"",""oid"":""6b8caf92-2bd6-4fc6-9ba2-3462b05cfc79"",""preferred_username"":""*"",""puid"":""10032002CE038AB7"",""rh"":""0.ARsAgjOeBNyMe0eTF5UbBGiWaAMAAAAAAPEPzgAAAAAAAAAbAEg."",""sid"":""4c736738-d5c4-4075-bde6-eca7974bfa50"",""sub"":""TlRti10Ln9tEE73wJcEKPxVDl5FeaFhfATsiFdTDIOU"",""tid"":""049e3382-8cdc-477b-9317-951b04689668"",""unique_name"":""*"",""upn"":""*@colliers.onmicrosoft.com"",""uti"":""kCFQyd3egkSd2_gbztq7AA"",""ver"":""1.0"",""wids"":[""13bd1c72-6f4a-4dcf-985f-18d3b80f208a""],""xms_cc"":[""CP1""],""xms_mpci"":259200,""xms_pci"":3600}.<scrubbed>'."
Medium,Successfully built an SPOAuthToken from the OpenID Connect JSON token and raw ticket.
Medium,"With CCSWebV2, CachedCredentialsService is also a supported Identity Provider."
Medium,Got identity provider. Value: 'AadEvoSts'.
Medium,"Got the JSON token claim value as a date-time. ClaimType: 'iat', ClaimValue: '04/03/2024 03:18:08'."
Medium,"Token audience matches the client id. ClientIdentifier: '00000003-0000-0ff1-ce00-000000000000', Audience: '00000003-0000-0ff1-ce00-000000000000'."
Medium,"Token issuer identifier matches the current tenant identifier. TenantIdentifier: '049e3382-8cdc-477b-9317-951b04689668', IssuerIdentifier: 'https://sts.windows.net/049e3382-8cdc-477b-9317-951b04689668/'."
Medium,Got the tenant id from the JSON token. TenantId: '049e3382-8cdc-477b-9317-951b04689668'.
Medium,"Token tenant identifier matches the current tenant identifier. TenantIdentifier: '049e3382-8cdc-477b-9317-951b04689668', TokenTenantIdentifier: '049e3382-8cdc-477b-9317-951b04689668'."
Medium,Leaving Monitored Scope: (Name=SPOAuthToken.ValidateReferredTokenBinding;StaticScopeId=6jnkp) Execution Time=0.0224; CPU Milliseconds=0; Managed Bytes=864; SQL Query Count=0; GCPauseMS=0; AllocBytes=2088;; Parent=Request (POST:https://colliers.sharepoint.com/_forms/default.aspx<scrubbed>)
Medium,The token is valid for sign-in pending Nonce cookie-token validation. Status: 'ValidTimeStamps | ValidAudience | ValidIssuer | ValidTenant | ValidNonceClaimPresent | ValidIdentityProvider | ValidRpsTokenV2 | ValidTokenBinding | ValidForOpenIdConnectInvitationAcceptanceWithoutNonceCheck | ValidForOpenIdConnectSignInWithoutNonceCheck | ValidForOpenIdConnectOperationsV2 | ValidForOpenIdConnectInvitationAcceptanceWithoutNonceCheckV2 | ValidForOpenIdConnectInvitationAcceptanceWithoutNonceCheckV3 | ValidForOpenIdConnectSignInWithoutNonceCheckV2'.
Medium,Ticket validation succeeded.
Medium,Successfully obtained a valid SPOAuthToken from the request to sign-in with.
Medium,Attempting to sign in with SPOAuthToken.
Medium,Got raw user name from the JSON token. RawUserName: <name>'327420_twgroup.co.nz#EXT#@colliers.onmicrosoft.com'</name>.
Medium,Got the identity provider from the JSON token. OriginalIdentityProvider: 'https://sts.windows.net/07e47c7e-9339-473b-8138-adb77559c551/'.
Medium,Got wids claim from ID token. Value: '13bd1c72-6f4a-4dcf-985f-18d3b80f208a'.
Medium,home_oid is not included in the JSON token.
Medium,Got the alternative security id from the JSON token. AlternativeSecurityId: '5::10032002CC6815D0'.
Medium,Using full host domain for cookie. CookieName: 'nSGt'.
Medium,"Successfully read nonce cookie. Version: '0', Seed: '44B602FE694829F67BF8AC8D232F631C75C8BA913342E6AD', Identifier: 'C394A2889538CCB075EB6A6105F3422F099774D7F10DAD64'."
Medium,Successfully read the Nonce cookie and validated it against the token Nonce claim value.
Medium,The JSON token nonce is valid because it has matching nonce cookie.
Medium,Trying to map user.
Medium,Trying to find connected account for tenant OpenID Connect token.
Medium,Got the puid from the JSON token. PUID: '10032002CE038AB7'.
Medium,The JSON token is for a tenant user.
Medium,"Connected account lookup for tenant user. UserName: <name>'327420_twgroup.co.nz#EXT#@colliers.onmicrosoft.com'</name>, Puid: '10032002CE038AB7',  AlternateSecurityId: '5::10032002CC6815D0'."
Medium,[SPOAuthSPODSAccessor.GetSPODSMode]: Got current SPODS Mode. Value: 'ADOnly'.
Medium,"Initializing ActiveDirectoryResolver from context was SUCCESSFUL for SPSite. Value: 'https://colliers.sharepoint.com/sites/NZ-EXT-TWG/Colliers360 Documents/Forms/AllItems.aspx?newTargetListUrl=/sites/NZ-EXT-TWG/Colliers360 Documents&viewpath=/sites/NZ-EXT-TWG/Colliers360 Documents/Forms/AllItems.aspx&id=/sites/NZ-EXT-TWG/Colliers360 Documents/0TWG1061/TWGL1536&viewid=de2e8716-31d2-4176-9035-16ecb9d966bd&sw=auth<scrubbed>', UsedValue: 'https://colliers.sharepoint.com/sites/NZ-EXT-TWG/Colliers360 Documents/Forms/AllItems.aspx?newTargetListUrl=/sites/NZ-EXT-TWG/Colliers360 Documents&viewpath=/sites/NZ-EXT-TWG/Colliers360 Documents/Forms/AllItems.aspx&id=/sites/NZ-EXT-TWG/Colliers360 Documents/0TWG1061/TWGL1536&viewid=de2e8716-31d2-4176-9035-16ecb9d966bd&sw=auth<scrubbed>'."
Medium,[ActiveDirectoryResolver]: In GetUserFromDirectoryAsProcess
Medium,"SetSpodsCredentialIfNeeded: Using custom credentials for Spods. Server 'LDAP://spd192625-054.spods192624.msft.net/OU=049e3382-8cdc-477b-9317-951b04689668,OU=Tenants,OU=MSOnline,DC=SPODS192624,DC=msft,DC=net', UserName: 'SPODS192624.msft.net\_DS192624_RD_7'."
Medium,Skipping load shedding evaluation for scope SPODS_ActiveDirectory
Medium,Leaving Monitored Scope: (Name=QueryDirectoryServices with high availability for login;StaticScopeId=6jnk9) Execution Time=5.9221; CPU Milliseconds=4; Managed Bytes=116264; SQL Query Count=0; GCPauseMS=0; AllocBytes=117616;; Parent=GuestHelper.TryFindUserInSPODS: SPOAuthSPODSAccessor.GetUser
Medium,userSearchResult = System.DirectoryServices.SearchResult
Medium,User search resulted in MsoAccountEnabled being true.
Medium,This is a new guest user: 327420_twgroup.co.nz#EXT#@colliers.onmicrosoft.com.
Medium,GetUtcDateTimeProperty: Received property as a DateTime instance. Property name: 'msOnline-StsRefreshTokensValidFrom' Incoming value: '8/1/2023 3:50:29 AM' Incoming kind: 'Unspecified'.
Medium,GetUtcDateTimeProperty: Received property as a DateTime instance. Property name: 'msOnline-StsRefreshTokensValidFrom' Value: '8/1/2023 3:50:29 AM' Kind: 'Utc'.
Medium,Leaving Monitored Scope: (Name=GuestHelper.TryFindUserInSPODS: SPOAuthSPODSAccessor.GetUser;StaticScopeId=6jnku) Execution Time=7.068; CPU Milliseconds=5; Managed Bytes=278936; SQL Query Count=0; GCPauseMS=0; AllocBytes=280416;; Parent=GuestHelper.TryFindConnectedAccount
Medium,TryFindConnectedAccount: found user '327420_twgroup.co.nz#EXT#@colliers.onmicrosoft.com' by PUID in SPODS. Ignoring.
Medium,Leaving Monitored Scope: (Name=GuestHelper.TryFindConnectedAccount;StaticScopeId=6jnkt) Execution Time=7.2992; CPU Milliseconds=5; Managed Bytes=299472; SQL Query Count=0; GCPauseMS=0; AllocBytes=301080;; Parent=Request (POST:https://colliers.sharepoint.com/_forms/default.aspx<scrubbed>)
Medium,Have not found connected account. UserName: <name>'327420_twgroup.co.nz#EXT#@colliers.onmicrosoft.com'</name>.
Medium,The JSON token is valid for tenant user sign-in.
Medium,All sign-in policy checks passed.
Medium,Using the Source element for sign-in target path.
High,context does not match contextUri. Not obtaining settings for context from cache.
Medium,Caching tenant user.
High,context does not match contextUri. Not obtaining settings for context from cache.
Medium,Access control claim is null or empty. ClaimType: 'controls'.
Medium,The ABT timeout property is returning computed value. Value: 'Null'.
Medium,"Got the JSON token claim value as a long. ClaimType: 'xms_pci', ClaimValue: '3600'."
Medium,Got the JSON token policy check interval. PolicyCheckInterval: '3600'.
Medium,Got the next CA policy check time. NextCAPolicyCheckTime: 04/03/2024 04:23:10.
Medium,"Got the JSON token claim value as a long. ClaimType: 'xms_mpci', ClaimValue: '259200'."
Medium,Got the JSON token policy check interval. MaxPolicyCheckInterval: '259200'.
Medium,Got the extended CA policy check time. ExtendedCAPolicyCheckTime: 04/06/2024 03:23:10.
Medium,The device id is not included in the JSON token so using the empty string.
Medium,The capolids_latebind claim is not included in the JSON token so using the empty string.
Medium,"Got the xms_cc claim from the JSON token. ClientCapabilities: '[""CP1""]'."
Medium,The xms_ssm claim is not included in the JSON token so using the empty string.
Medium,The xms_caechecks claim is not included in the JSON token.
Medium,The xms_rp_ipaddr claim is not included in the JSON token so using the empty string.
Medium,The tenant restrictions policy id claim is not included in the JSON token so using the empty string.
Medium,"Got the AuthContext claim from the JSON token: '[""urn:user:registersecurityinfo""]'."
Medium,Got the preferred_username claim from the JSON token. Value: <name>'327420@twgroup.co.nz'</name>.
Medium,Got the unique token id from the JSON token. Value: 'kCFQyd3egkSd2_gbztq7AA'.
Medium,Got the object id from the JSON token. ObjectId: '6b8caf92-2bd6-4fc6-9ba2-3462b05cfc79'.
Medium,Leaving Monitored Scope: (Name=SPSiteInfoData.Serialize;StaticScopeId=6gu6l) Execution Time=0.0289; CPU Milliseconds=0; Managed Bytes=5392; SQL Query Count=0; GCPauseMS=0; AllocBytes=6616;; Parent=FormsSignInPage.AuthenticateEventHandler: Retrieve security token and establish session.
Medium,SecurityTokenServiceReceiveRequest: Calling correlation id. Value: '83421ba1-90ce-5000-3bd3-67dec0971e06'.
Medium,The user key provider instance is created and set on the thread context.
Medium,STS Call: Creating Claims Operations Scope for Applies To Uri: 'https://colliers.sharepoint.com/sites/NZ-EXT-TWG/Colliers360 Documents/Forms/AllItems.aspx?newTargetListUrl=/sites/NZ-EXT-TWG/Colliers360 Documents&viewpath=/sites/NZ-EXT-TWG/Colliers360 Documents/Forms/AllItems.aspx&id=/sites/NZ-EXT-TWG/Colliers360 Documents/0TWG1061/TWGL1536&viewid=de2e8716-31d2-4176-9035-16ecb9d966bd&sw=auth<scrubbed><scrubbed>'.
Medium,Leaving Monitored Scope: (Name=SPSiteInfoData.Deserialize;StaticScopeId=6gu6k) Execution Time=0.0315; CPU Milliseconds=0; Managed Bytes=856; SQL Query Count=0; GCPauseMS=0; AllocBytes=2080;; Parent=SPSecurityTokenService.Issue
Medium,Created claims operation context with values passed from the content application pool.
Medium,SetupUserValidationType: Sign-in operation. Username: <name>327420_twgroup.co.nz#EXT#@colliers.onmicrosoft.com</name>.
Medium,Using SPClaimsOperationContext without HttpContext. Scope: '7669dc6c-1c61-4add-918e-c7e4843aec7c'.
Medium,Checking for MSA tenant.
Medium,Tested site subscription for MSA context. Value: 'False'.
Medium,The site configuration environment is null.
Medium,MsaTenant: SPOAuthHelper NOT configuring for MsaTenant because MsaTenantUtils.IsMsaTenant() is false.
Medium,Attempting to get a SPOAuthToken from raw ticket.
Medium,Obtained update lock and refreshed the value.
Unexpected,The authentication request context or the logging events are null.
Medium,The request is made with a token with key identifier 'q-23falevZhhD3hm9CQbkP5MQyU' and thumbprint 'ABEDB77DA95EBD98610F7866F4241B90FE4C4325'.
Medium,Successfully built an OpenID Connect JSON token object from the raw ticket.
Medium,Audience Guid matches current App Id Guid. Audience: '00000003-0000-0ff1-ce00-000000000000'.
Medium,Audience Guid matches current App Id Guid. Audience: '00000003-0000-0ff1-ce00-000000000000'.
Unexpected,Failed to get current subscription id.
Medium,Successfully validated OpenID Connect JSON token.
Medium,"Id token: '{""typ"":""JWT"",""alg"":""RS256"",""x5t"":""q-23falevZhhD3hm9CQbkP5MQyU"",""kid"":""q-23falevZhhD3hm9CQbkP5MQyU""}.{""aud"":""00000003-0000-0ff1-ce00-000000000000"",""iss"":""https://sts.windows.net/049e3382-8cdc-477b-9317-951b04689668/"",""iat"":1712114288,""nbf"":1712114288,""exp"":1712118188,""acrs"":[""urn:user:registersecurityinfo""],""aio"":""AUQAu/8WAAAAVxuwgV8ADVI4cEXkf+mFxVunVz9bqRNOj0lFwNdvg3MDummx4WaCiCjOgmXoFQXuTWIYsHpUkcxCeKcweY7xTg=="",""altsecid"":""5::10032002CC6815D0"",""amr"":[""pwd""],""auth_time"":1706733039,""c_hash"":""OI3fq0hYUaBUHHMmaIe6PQ"",""e_exp"":262798,""email"":""*@twgroup.co.nz"",""idp"":""https://sts.windows.net/07e47c7e-9339-473b-8138-adb77559c551/"",""ipaddr"":""203.97.64.20"",""name"":""*"",""nonce"":""C394A2889538CCB075EB6A6105F3422F099774D7F10DAD64-394A1EF663185D5C2A0E3854B36814F665BB00AB80C53E596C0E3585D418D3EF"",""oid"":""6b8caf92-2bd6-4fc6-9ba2-3462b05cfc79"",""preferred_username"":""*"",""puid"":""10032002CE038AB7"",""rh"":""0.ARsAgjOeBNyMe0eTF5UbBGiWaAMAAAAAAPEPzgAAAAAAAAAbAEg."",""sid"":""4c736738-d5c4-4075-bde6-eca7974bfa50"",""sub"":""TlRti10Ln9tEE73wJcEKPxVDl5FeaFhfATsiFdTDIOU"",""tid"":""049e3382-8cdc-477b-9317-951b04689668"",""unique_name"":""*"",""upn"":""*@colliers.onmicrosoft.com"",""uti"":""kCFQyd3egkSd2_gbztq7AA"",""ver"":""1.0"",""wids"":[""13bd1c72-6f4a-4dcf-985f-18d3b80f208a""],""xms_cc"":[""CP1""],""xms_mpci"":259200,""xms_pci"":3600}.<scrubbed>'."
Medium,Successfully built an SPOAuthToken from the OpenID Connect JSON token and raw ticket.
Medium,"With CCSWebV2, CachedCredentialsService is also a supported Identity Provider."
Medium,Got identity provider. Value: 'AadEvoSts'.
Medium,"Got the JSON token claim value as a date-time. ClaimType: 'iat', ClaimValue: '04/03/2024 03:18:08'."
Medium,"Token audience matches the client id. ClientIdentifier: '00000003-0000-0ff1-ce00-000000000000', Audience: '00000003-0000-0ff1-ce00-000000000000'."
Medium,"Token issuer identifier matches the current tenant identifier. TenantIdentifier: '049e3382-8cdc-477b-9317-951b04689668', IssuerIdentifier: 'https://sts.windows.net/049e3382-8cdc-477b-9317-951b04689668/'."
Medium,Got the tenant id from the JSON token. TenantId: '049e3382-8cdc-477b-9317-951b04689668'.
Medium,"Token tenant identifier matches the current tenant identifier. TenantIdentifier: '049e3382-8cdc-477b-9317-951b04689668', TokenTenantIdentifier: '049e3382-8cdc-477b-9317-951b04689668'."
Medium,Leaving Monitored Scope: (Name=SPOAuthToken.ValidateReferredTokenBinding;StaticScopeId=6jnkp) Execution Time=0.0238; CPU Milliseconds=0; Managed Bytes=784; SQL Query Count=0; GCPauseMS=0; AllocBytes=2008;; Parent=SPSecurityTokenService.Issue
Medium,The token is valid for sign-in pending Nonce cookie-token validation. Status: 'ValidTimeStamps | ValidAudience | ValidIssuer | ValidTenant | ValidNonceClaimPresent | ValidIdentityProvider | ValidRpsTokenV2 | ValidTokenBinding | ValidForOpenIdConnectInvitationAcceptanceWithoutNonceCheck | ValidForOpenIdConnectSignInWithoutNonceCheck | ValidForOpenIdConnectOperationsV2 | ValidForOpenIdConnectInvitationAcceptanceWithoutNonceCheckV2 | ValidForOpenIdConnectInvitationAcceptanceWithoutNonceCheckV3 | ValidForOpenIdConnectSignInWithoutNonceCheckV2'.
Medium,Ticket validation succeeded.
Medium,Got wids claim from ID token. Value: '13bd1c72-6f4a-4dcf-985f-18d3b80f208a'.
Medium,home_oid is not included in the JSON token.
Medium,Trying to map user.
Medium,Trying to find connected account for tenant OpenID Connect token.
Medium,Got the alternative security id from the JSON token. AlternativeSecurityId: '5::10032002CC6815D0'.
Medium,Got raw user name from the JSON token. RawUserName: <name>'327420_twgroup.co.nz#EXT#@colliers.onmicrosoft.com'</name>.
Medium,Got the puid from the JSON token. PUID: '10032002CE038AB7'.
Medium,The JSON token is for a tenant user.
Medium,"Connected account lookup for tenant user. UserName: <name>'327420_twgroup.co.nz#EXT#@colliers.onmicrosoft.com'</name>, Puid: '10032002CE038AB7',  AlternateSecurityId: '5::10032002CC6815D0'."
Medium,[SPOAuthSPODSAccessor.GetSPODSMode]: Got current SPODS Mode. Value: 'ADOnly'.
Medium,"Initializing ActiveDirectoryResolver from context was SUCCESSFUL for SPSite. Value: 'https://colliers.sharepoint.com/sites/NZ-EXT-TWG/Colliers360 Documents/Forms/AllItems.aspx?newTargetListUrl=/sites/NZ-EXT-TWG/Colliers360 Documents&viewpath=/sites/NZ-EXT-TWG/Colliers360 Documents/Forms/AllItems.aspx&id=/sites/NZ-EXT-TWG/Colliers360 Documents/0TWG1061/TWGL1536&viewid=de2e8716-31d2-4176-9035-16ecb9d966bd&sw=auth<scrubbed>', UsedValue: 'https://colliers.sharepoint.com/sites/NZ-EXT-TWG/Colliers360 Documents/Forms/AllItems.aspx?newTargetListUrl=/sites/NZ-EXT-TWG/Colliers360 Documents&viewpath=/sites/NZ-EXT-TWG/Colliers360 Documents/Forms/AllItems.aspx&id=/sites/NZ-EXT-TWG/Colliers360 Documents/0TWG1061/TWGL1536&viewid=de2e8716-31d2-4176-9035-16ecb9d966bd&sw=auth<scrubbed>'."
Medium,[ActiveDirectoryResolver]: In GetUserFromDirectoryAsProcess
Medium,"SetSpodsCredentialIfNeeded: Using custom credentials for Spods. Server 'LDAP://spd192625-054.spods192624.msft.net/OU=049e3382-8cdc-477b-9317-951b04689668,OU=Tenants,OU=MSOnline,DC=SPODS192624,DC=msft,DC=net', UserName: 'SPODS192624.msft.net\_DS192624_RD_7'."
Unexpected,The argument does not have the encoding separator. Argument name : 'encodedValue'.
Medium,Leaving Monitored Scope: (Name=QueryDirectoryServices with high availability for login;StaticScopeId=6jnk9) Execution Time=5.3678; CPU Milliseconds=3; Managed Bytes=119408; SQL Query Count=0; GCPauseMS=0; AllocBytes=120760;; Parent=GuestHelper.TryFindUserInSPODS: SPOAuthSPODSAccessor.GetUser
Medium,userSearchResult = System.DirectoryServices.SearchResult
Medium,User search resulted in MsoAccountEnabled being true.
Medium,This is a new guest user: 327420_twgroup.co.nz#EXT#@colliers.onmicrosoft.com.
Medium,GetUtcDateTimeProperty: Received property as a DateTime instance. Property name: 'msOnline-StsRefreshTokensValidFrom' Incoming value: '8/1/2023 3:50:29 AM' Incoming kind: 'Unspecified'.
Medium,GetUtcDateTimeProperty: Received property as a DateTime instance. Property name: 'msOnline-StsRefreshTokensValidFrom' Value: '8/1/2023 3:50:29 AM' Kind: 'Utc'.
Medium,Leaving Monitored Scope: (Name=GuestHelper.TryFindUserInSPODS: SPOAuthSPODSAccessor.GetUser;StaticScopeId=6jnku) Execution Time=11.3738; CPU Milliseconds=5; Managed Bytes=320568; SQL Query Count=0; GCPauseMS=0; AllocBytes=322048;; Parent=GuestHelper.TryFindConnectedAccount
Medium,TryFindConnectedAccount: found user '327420_twgroup.co.nz#EXT#@colliers.onmicrosoft.com' by PUID in SPODS. Ignoring.
Medium,Leaving Monitored Scope: (Name=GuestHelper.TryFindConnectedAccount;StaticScopeId=6jnkt) Execution Time=12.1128; CPU Milliseconds=6; Managed Bytes=357920; SQL Query Count=0; GCPauseMS=0; AllocBytes=359528;; Parent=SPSecurityTokenService.Issue
Medium,Have not found connected account. UserName: <name>'327420_twgroup.co.nz#EXT#@colliers.onmicrosoft.com'</name>.
Medium,The JSON token is valid for tenant user sign-in.
Medium,"Got the JSON token claim value as a date-time. ClaimType: 'auth_time', ClaimValue: '01/31/2024 20:30:39'."
Medium,Got the JSON token autenticaiton time. AuthInstant: '01/31/2024 20:30:39'.
Medium,"Got the JSON token claim value as a date-time. ClaimType: 'iat', ClaimValue: '04/03/2024 03:18:08'."
Medium,Got ValidFrom property from Json token. Result: '2024-04-03 03:23:08'.
Medium,Got the identity provider from the JSON token. OriginalIdentityProvider: 'https://sts.windows.net/07e47c7e-9339-473b-8138-adb77559c551/'.
Medium,Got the session id from the JSON token. SessionId: '4c736738-d5c4-4075-bde6-eca7974bfa50'.
Medium,"PopulatePropertiesForValidateUser: Adding the following claims for potential partner user. Idp: 'https://sts.windows.net/07e47c7e-9339-473b-8138-adb77559c551/', Email: '327420@twgroup.co.nz'."
Medium,"Token Handler: Claims Forms Sign-In: Enhanced username-password check for user succeeded. MembershipProvider: 'membership', UserName: <name>'327420_twgroup.co.nz#EXT#@colliers.onmicrosoft.com'</name>."
Medium,"AddClaimFromProperties: Found valid claim. ClaimType: 'http://schemas.microsoft.com/office/2017/03/SessionId', Value: '4c736738-d5c4-4075-bde6-eca7974bfa50'."
Medium,"AddClaimFromProperties: Found valid claim. ClaimType: 'http://schemas.microsoft.com/office/2017/05/HomeTenantId', Value: 'https://sts.windows.net/07e47c7e-9339-473b-8138-adb77559c551/'."
Medium,"AddClaimFromProperties: Found valid claim. ClaimType: 'http://schemas.microsoft.com/office/2017/05/PartnerUserEmail', Value: '327420@twgroup.co.nz'."
Medium,"AddClaimFromProperties: Found valid claim. ClaimType: 'http://schemas.microsoft.com/sharepoint/online/2021/10/claims/originalidentityprovider', Value: 'https://sts.windows.net/07e47c7e-9339-473b-8138-adb77559c551/'."
Medium,AddIncomingValidFromTimeClaim: This is a sign in request. Not adding this claim because we will get a new value from the token.
Medium,"No identity provider claim on the identity. ClaimType: 'http://schemas.microsoft.com/sharepoint/2009/08/claims/identityprovider', IdentityName: <name>'IIS APPPOOL\SharePoint Content Services'</name>."
Medium,"No identity provider claim on the identity. ClaimType: 'http://schemas.microsoft.com/sharepoint/2009/08/claims/identityprovider', IdentityName: <name>'327420_twgroup.co.nz#EXT#@colliers.onmicrosoft.com'</name>."
Medium,Initialized session revocation members. Auth instant: '01/31/2024 20:30:39' AVF: ''. IssuedAt: '04/03/2024 03:23:08'. NotBefore: '04/03/2024 03:23:08'. Form operation type: ''.
Medium,Initialize session attributes: Success from request properties: 'IsBrowser'.
Medium,TryInitializeSessionIdForForms: Success. Value: '4c736738-d5c4-4075-bde6-eca7974bfa50'
Medium,Initialize next CA policy check time. Value: '133565917909687932'.
Medium,Initialize extended CA policy check time. Value: '133568473909687932'.
